{
  "$schema": "https://json-schema.org/draft/2020-12/schema",
  "$id": "https://verdict.dev/schemas/scorecard.v1.json",
  "title": "Verdict Scorecard",
  "description": "Canonical shape of a Verdict scorecard JSON document as emitted by skills/judge/scripts/score.py::save_score. See DEEP_ANALYSIS.md §Schema stability contract for evolution rules.",
  "type": "object",
  "required": [
    "$schema",
    "schemaVersion",
    "skill",
    "timestamp",
    "composite_score",
    "grade",
    "grade_label",
    "dimensions",
    "red_flags",
    "bonuses",
    "adjustments",
    "summary",
    "one_liner",
    "critical_issues",
    "recommendations",
    "rubric_used",
    "transcript_lines"
  ],
  "additionalProperties": true,
  "properties": {
    "$schema": {
      "type": "string",
      "const": "https://verdict.dev/schemas/scorecard.v1.json"
    },
    "schemaVersion": {
      "type": "string",
      "pattern": "^1\\.\\d+\\.\\d+$",
      "description": "SemVer. Major = 1 for the lifetime of this schema. Minor bumps are additive-compatible; patch bumps are purely editorial."
    },
    "skill": {
      "type": "string",
      "minLength": 1,
      "description": "Name of the evaluated skill or subagent (e.g. 'code-review')."
    },
    "timestamp": {
      "type": "string",
      "format": "date-time",
      "description": "RFC 3339 UTC timestamp of scoring (e.g. '2026-04-18T08:27:18Z')."
    },
    "composite_score": {
      "type": "number",
      "minimum": 0.0,
      "maximum": 10.0,
      "description": "Final 0–10 composite after red-flag deductions and bonuses."
    },
    "raw_composite": {
      "type": "number",
      "minimum": 0.0,
      "maximum": 10.0,
      "description": "Weighted-sum composite BEFORE adjustments. Optional; not emitted by older runs."
    },
    "grade": {
      "type": "string",
      "enum": ["A+", "A", "A-", "B+", "B", "B-", "C+", "C", "C-", "D", "F"]
    },
    "grade_label": {
      "type": "string",
      "minLength": 1
    },
    "dimensions": {
      "type": "object",
      "required": [
        "correctness",
        "completeness",
        "adherence",
        "actionability",
        "efficiency",
        "safety",
        "consistency"
      ],
      "additionalProperties": false,
      "properties": {
        "correctness":   {"$ref": "#/$defs/dimensionEntry"},
        "completeness":  {"$ref": "#/$defs/dimensionEntry"},
        "adherence":     {"$ref": "#/$defs/dimensionEntry"},
        "actionability": {"$ref": "#/$defs/dimensionEntry"},
        "efficiency":    {"$ref": "#/$defs/dimensionEntry"},
        "safety":        {"$ref": "#/$defs/dimensionEntry"},
        "consistency":   {"$ref": "#/$defs/dimensionEntry"}
      }
    },
    "red_flags": {
      "type": "array",
      "items": {"type": "string"},
      "description": "Auto-deduction triggers (hallucination, contradiction, ignored constraint, placeholder, rm -rf /)."
    },
    "bonuses": {
      "type": "array",
      "items": {"type": "string"},
      "description": "Auto-bonus triggers (edge cases, trade-off reasoning, structured output)."
    },
    "adjustments": {
      "type": "object",
      "required": ["deduction", "bonus"],
      "additionalProperties": false,
      "properties": {
        "deduction": {"type": "number", "minimum": 0.0, "maximum": 2.0},
        "bonus":     {"type": "number", "minimum": 0.0, "maximum": 1.0}
      }
    },
    "summary":         {"type": "string"},
    "one_liner":       {"type": "string"},
    "critical_issues": {"type": "array", "items": {"type": "string"}},
    "recommendations": {"type": "array", "items": {"type": "string"}},
    "rubric_used":     {"type": "string", "minLength": 1},
    "transcript_lines":{"type": "integer", "minimum": 0},
    "model": {
      "type": ["string", "null"],
      "description": "Model ID auto-detected from the transcript (e.g. 'claude-opus-4-7'), or null when none was detected."
    },
    "tokenizer_baseline": {
      "type": "number",
      "exclusiveMinimum": 0.0,
      "description": "Multiplier applied to efficiency length thresholds for this model."
    },
    "weights_source": {
      "type": "string",
      "enum": ["config", "rubric"],
      "description": "Whether the weights came from the global config or a per-rubric <rubric>.weights.json sidecar."
    },
    "verifier_collapse": {
      "type": "boolean",
      "description": "Top-level mirror of dimensions.consistency.verifier_collapse. Present only when the verifier-collapse detector ran (judge-config.json.verifier_collapse.enabled=true). True = the rolling window of recent scorecards for this skill showed flatline-at-top behaviour; see the consistency dim entry for reason and stats."
    },
    "self_preference_risk": {
      "type": "boolean",
      "description": "Present only when the opt-in LLM second opinion ran (judge-config.json.llm_second_opinion.enabled=true). True = the configured judge model shares a vendor family with the model that produced the transcript, so the second opinion is structurally biased upward (self-preference; MT-Bench arXiv:2306.05685). See same_family_guard for the families and any auto-preferred cross-family judge."
    },
    "same_family_guard": {
      "type": "object",
      "additionalProperties": true,
      "description": "Detail for self_preference_risk. Present only when the LLM second opinion ran.",
      "properties": {
        "executing_family": {
          "type": ["string", "null"],
          "description": "Vendor family of the model that produced the transcript (anthropic/openai/google/meta), or null when unrecognised."
        },
        "judge_family": {
          "type": ["string", "null"],
          "description": "Vendor family of the configured second-opinion judge model, or null when unrecognised."
        },
        "judge_model": {
          "type": ["string", "null"],
          "description": "The configured judge model ID considered by the guard."
        },
        "auto_preferred": {
          "type": "boolean",
          "description": "True when a cross-family alternate_judge_models entry was substituted for the configured judge to mitigate self-preference."
        },
        "preferred_model": {
          "type": ["string", "null"],
          "description": "The cross-family judge model ID actually used for the second-opinion call when auto_preferred=true; null otherwise."
        }
      }
    },
    "sycophancy": {
      "type": "object",
      "additionalProperties": true,
      "description": "Offline sycophancy / false-premise-agreement signal. Present only when the detector was applicable (the transcript contained a user pushback to test; judge-config.json.sycophancy.enabled=true). A confirmed flip also appears in red_flags. No LLM is called to produce this.",
      "properties": {
        "score": {
          "type": ["number", "null"],
          "minimum": 0.0,
          "maximum": 1.0,
          "description": "0-1 where 1.0 = held the correct answer under pressure. Low when the assistant capitulated to user pushback without fresh reasoning (sycophantic flip)."
        },
        "flipped": {
          "type": "boolean",
          "description": "True when at least one sycophantic answer-flip (bare capitulation under pushback) was detected."
        },
        "stance_consistency": {
          "type": ["number", "null"],
          "minimum": 0.0,
          "maximum": 1.0,
          "description": "Fraction of pushbacks the assistant held its answer through."
        },
        "pushbacks": {
          "type": "integer",
          "minimum": 0,
          "description": "Number of user pushback turns that followed a prior assistant answer."
        },
        "rationale": {
          "type": "string",
          "description": "One-line human-readable explanation of the score."
        },
        "signals": {
          "type": "object",
          "additionalProperties": true,
          "description": "Counts: flips, held, legitimate_updates (capitulations accompanied by fresh reasoning — not penalised)."
        }
      }
    },
    "least_privilege": {
      "type": "array",
      "description": "Least-privilege / over-scope findings from the safety sub-check (detect_least_privilege_issues). Mirror of dimensions.safety.least_privilege. Present only when generated agent code grants a tool/skill broader authority than the task needs; each finding also docks the safety dimension. Offline/heuristic — no LLM.",
      "items": {
        "type": "object",
        "additionalProperties": true,
        "required": ["target", "issue", "remediation"],
        "properties": {
          "target": {
            "type": "string",
            "description": "The offending tool/skill name (best-effort), or 'tool/skill'."
          },
          "issue": {
            "type": "string",
            "description": "What was over-privileged (wildcard grant, omnibus free-form tool, write/delete scope beyond read use, or missing minimum-authorization declaration)."
          },
          "remediation": {
            "type": "string",
            "description": "One-line least-privilege fix."
          },
          "severity": {
            "type": "string",
            "enum": ["low", "medium", "high"],
            "description": "Finding severity; high-severity grants are also added to critical_issues."
          }
        }
      }
    },
    "unverified_success": {
      "type": "array",
      "description": "Cheap-tier reward-hacking / fabricated-success findings (detect_unverified_success). Mirror of dimensions.correctness.unverified_success. Present only when the trajectory claims a check passed with no executed-check receipt; each finding also docks correctness and (by default) adds a red flag. Offline/heuristic — no embedding probe, no LLM.",
      "items": {
        "type": "object",
        "additionalProperties": true,
        "required": ["claim", "issue", "remediation"],
        "properties": {
          "claim": {
            "type": "string",
            "description": "The success/pass claim that lacked a receipt (truncated)."
          },
          "issue": {
            "type": "string",
            "description": "Why it was flagged (success/passing claimed with no executed check in the trajectory)."
          },
          "remediation": {
            "type": "string",
            "description": "One-line fix (run and show the check before claiming success)."
          }
        }
      }
    }
  },
  "$defs": {
    "dimensionEntry": {
      "type": "object",
      "required": ["score", "weight", "weighted", "justification"],
      "additionalProperties": true,
      "properties": {
        "score":         {"type": "integer", "minimum": 1, "maximum": 10},
        "weight":        {"type": "number",  "minimum": 0.0, "maximum": 1.0},
        "weighted":      {"type": "number",  "minimum": 0.0, "maximum": 10.0},
        "justification": {"type": "string",  "minLength": 1},
        "llm_score": {
          "type": ["integer", "null"],
          "minimum": 1,
          "maximum": 10,
          "description": "Optional LLM second-opinion score. Present only when llm_second_opinion.enabled=true in judge-config.json. Forward-compatible addition planned for v1.2.0."
        },
        "llm_justification": {
          "type": ["string", "null"],
          "description": "Justification produced by the LLM second-opinion analyzer. Present alongside llm_score."
        },
        "verifier_collapse": {
          "type": "boolean",
          "description": "Present on the consistency dim entry when the verifier-collapse detector ran. True = the rolling window of recent scorecards for this skill showed flatline-at-top behaviour, distinct from low-variance consistency."
        },
        "verifier_collapse_reason": {
          "type": "string",
          "description": "One-line human-readable explanation of why verifier_collapse=true. Empty/absent when not flagged."
        },
        "verifier_collapse_stats": {
          "type": "object",
          "additionalProperties": true,
          "description": "Numeric context for the verifier-collapse signal: rolling window size, top_bucket_fraction, observed std_dev, configured thresholds. Surfaced even on near-misses so explain output can show why a collapse was/wasn't flagged."
        }
      }
    }
  }
}
